{
  "ratios": {
    "rows": [
      {
        "label": "Debtor Days",
        "values": [
          "79",
          "81",
          "70",
          "74",
          "68",
          "71",
          "67",
          "80",
          "81",
          "81",
          "84",
          "93"
        ]
      },
      {
        "label": "Inventory Days",
        "values": [
          null,
          null,
          null,
          null,
          null,
          null,
          null,
          null,
          null,
          null,
          null,
          null
        ]
      },
      {
        "label": "Days Payable",
        "values": [
          null,
          null,
          null,
          null,
          null,
          null,
          null,
          null,
          null,
          null,
          null,
          null
        ]
      },
      {
        "label": "Cash Conversion Cycle",
        "values": [
          "79",
          "81",
          "70",
          "74",
          "68",
          "71",
          "67",
          "80",
          "81",
          "81",
          "84",
          "93"
        ]
      },
      {
        "label": "Working Capital Days",
        "values": [
          "33",
          "62",
          "62",
          "61",
          "70",
          "64",
          "59",
          "33",
          "30",
          "34",
          "34",
          "38"
        ]
      },
      {
        "label": "ROCE %",
        "values": [
          "50%",
          "51%",
          "44%",
          "39%",
          "47%",
          "47%",
          "49%",
          "54%",
          "59%",
          "64%",
          "65%",
          "63%"
        ]
      }
    ],
    "unit": "As displayed on Screener",
    "basis": "consolidated",
    "periods": [
      "Mar 2015",
      "Mar 2016",
      "Mar 2017",
      "Mar 2018",
      "Mar 2019",
      "Mar 2020",
      "Mar 2021",
      "Mar 2022",
      "Mar 2023",
      "Mar 2024",
      "Mar 2025",
      "Mar 2026"
    ]
  },
  "source": {
    "url": "https://www.screener.in/company/TCS/consolidated/",
    "basis": "consolidated",
    "fetched_at": "2026-10-04T05:58:04.642Z",
    "scraper_name": "playwright",
    "scraper_version": "1.61.0"
  },
  "overview": {
    "roe": "51.8 %",
    "roce": "63.0 %",
    "about": "Tata Consultancy Services is the flagship company and a part of Tata group. It is an IT services, consulting and business solutions organization that has been partnering with many of the world's largest businesses in their transformation journeys for over 50 years. TCS offers a consulting-led, cognitive powered, integrated portfolio of business, technology and engineering services and solutions. [1]",
    "symbol": "TCS",
    "website": "http://www.tcs.com/",
    "bse_code": "532540",
    "high_low": "₹ 3,350 / 1,976",
    "logo_url": "https://cdn-media.screener.in/company-logos/thumbnails/6e4e5d028e4099ab72182084.webp",
    "stock_pe": "14.0",
    "book_value": "₹ 296",
    "face_value": "₹ 1.00",
    "key_points": "Revenue Breakup Q3FY26[1] BFSI : 31.9% Consumer Business : 15.4% Life Sciences & Healthcare : 10.5% Manufacturing : 8.8% Technology & Services : 8.4% Communication & Media : 5.9% Energy, Resources and Utilities : 6% Regional Markets & Others : 13.1%",
    "market_cap": "₹ 7,50,753 Cr.",
    "nse_symbol": "TCS",
    "price_as_of": "01 Oct - close price",
    "company_name": "Tata Consultancy Services Ltd",
    "current_price": "₹ 2,075",
    "dividend_yield": "3.08 %",
    "price_change_percent": "1.19%"
  },
  "cash_flows": {
    "rows": [
      {
        "label": "Cash from Operating Activity",
        "values": [
          "19,369",
          "19,109",
          "25,223",
          "25,067",
          "28,593",
          "32,369",
          "38,802",
          "39,949",
          "41,965",
          "44,338",
          "48,908",
          "52,094"
        ]
      },
      {
        "label": "Cash from Investing Activity",
        "values": [
          "-1,807",
          "-5,010",
          "-16,895",
          "3,104",
          "1,645",
          "8,968",
          "-7,956",
          "-738",
          "548",
          "6,091",
          "-2,144",
          "-11,886"
        ]
      },
      {
        "label": "Cash from Financing Activity",
        "values": [
          "-17,168",
          "-9,666",
          "-11,026",
          "-26,885",
          "-27,897",
          "-39,915",
          "-32,634",
          "-33,581",
          "-47,878",
          "-48,536",
          "-47,438",
          "-42,133"
        ]
      },
      {
        "label": "Net Cash Flow",
        "values": [
          "394",
          "4,433",
          "-2,698",
          "1,286",
          "2,341",
          "1,422",
          "-1,788",
          "5,630",
          "-5,365",
          "1,893",
          "-674",
          "-1,925"
        ]
      },
      {
        "label": "Free Cash Flow",
        "values": [
          "16,426",
          "17,144",
          "23,270",
          "23,263",
          "26,461",
          "29,281",
          "35,663",
          "36,985",
          "38,902",
          "41,688",
          "44,994",
          "48,013"
        ]
      },
      {
        "label": "CFO/OP",
        "values": [
          "110%",
          "87%",
          "103%",
          "100%",
          "98%",
          "91%",
          "103%",
          "97%",
          "93%",
          "88%",
          "96%",
          "92%"
        ]
      }
    ],
    "unit": "Rs. Crores",
    "basis": "consolidated",
    "periods": [
      "Mar 2015",
      "Mar 2016",
      "Mar 2017",
      "Mar 2018",
      "Mar 2019",
      "Mar 2020",
      "Mar 2021",
      "Mar 2022",
      "Mar 2023",
      "Mar 2024",
      "Mar 2025",
      "Mar 2026"
    ]
  },
  "balance_sheet": {
    "rows": [
      {
        "label": "Equity Capital",
        "values": [
          "196",
          "197",
          "197",
          "191",
          "375",
          "375",
          "370",
          "366",
          "366",
          "362",
          "362",
          "362"
        ]
      },
      {
        "label": "Reserves",
        "values": [
          "50,439",
          "70,875",
          "86,017",
          "84,937",
          "89,071",
          "83,751",
          "86,063",
          "88,773",
          "90,058",
          "90,127",
          "94,394",
          "106,878"
        ]
      },
      {
        "label": "Borrowings",
        "values": [
          "358",
          "245",
          "289",
          "247",
          "62",
          "8,174",
          "7,795",
          "7,818",
          "7,688",
          "8,021",
          "9,392",
          "11,283"
        ]
      },
      {
        "label": "Other Liabilities",
        "values": [
          "22,325",
          "16,974",
          "15,830",
          "19,751",
          "24,393",
          "27,827",
          "35,764",
          "43,967",
          "44,747",
          "46,962",
          "54,501",
          "62,644"
        ]
      },
      {
        "label": "Total Liabilities",
        "values": [
          "73,318",
          "88,291",
          "102,333",
          "105,126",
          "113,901",
          "120,127",
          "129,992",
          "140,924",
          "142,859",
          "145,472",
          "158,649",
          "181,167"
        ]
      },
      {
        "label": "Fixed Assets",
        "values": [
          "11,638",
          "11,774",
          "11,701",
          "11,973",
          "12,290",
          "20,928",
          "21,021",
          "21,298",
          "20,515",
          "19,604",
          "23,053",
          "31,343"
        ]
      },
      {
        "label": "CWIP",
        "values": [
          "2,766",
          "1,670",
          "1,541",
          "1,278",
          "963",
          "906",
          "926",
          "1,205",
          "1,234",
          "1,564",
          "1,546",
          "2,665"
        ]
      },
      {
        "label": "Investments",
        "values": [
          "1,662",
          "22,822",
          "41,980",
          "36,008",
          "29,330",
          "26,356",
          "29,373",
          "30,485",
          "37,163",
          "31,762",
          "30,964",
          "33,988"
        ]
      },
      {
        "label": "Other Assets",
        "values": [
          "57,252",
          "52,025",
          "47,111",
          "55,867",
          "71,318",
          "71,937",
          "78,672",
          "87,936",
          "83,947",
          "92,542",
          "103,086",
          "113,171"
        ]
      },
      {
        "label": "Total Assets",
        "values": [
          "73,318",
          "88,291",
          "102,333",
          "105,126",
          "113,901",
          "120,127",
          "129,992",
          "140,924",
          "142,859",
          "145,472",
          "158,649",
          "181,167"
        ]
      }
    ],
    "unit": "Rs. Crores",
    "basis": "consolidated",
    "periods": [
      "Mar 2015",
      "Mar 2016",
      "Mar 2017",
      "Mar 2018",
      "Mar 2019",
      "Mar 2020",
      "Mar 2021",
      "Mar 2022",
      "Mar 2023",
      "Mar 2024",
      "Mar 2025",
      "Mar 2026"
    ]
  },
  "chart_snapshots": {
    "1y": {
      "image": "https://fbulwdsiowhtctxkajvr.supabase.co/storage/v1/object/public/screener-charts/ecfcabfc-0065-4551-ad34-77400f732427/TCS/1y.png",
      "range": "1y",
      "source_url": "https://www.screener.in/company/TCS/consolidated/",
      "captured_at": "2026-10-04T05:58:08.432Z",
      "price_label": "Price on NSE",
      "volume_included": true
    },
    "3y": {
      "image": "https://fbulwdsiowhtctxkajvr.supabase.co/storage/v1/object/public/screener-charts/ecfcabfc-0065-4551-ad34-77400f732427/TCS/3y.png",
      "range": "3y",
      "source_url": "https://www.screener.in/company/TCS/consolidated/",
      "captured_at": "2026-10-04T05:58:10.347Z",